{
  "schemaVersion": "1.2",
  "id": "fd10c0ba-55d6-447f-beae-53915ca987e5",
  "slug": "enable-storage-sense",
  "type": "script",
  "name": "Enable Storage Sense",
  "description": "Turns Storage Sense on machine-wide and sets it to run monthly, clearing temporary files and emptying the recycle bin after 30 days. Prevention rather than a one-off clean.",
  "version": "1.0.0",
  "release": "production",
  "os": "Windows",
  "icon": "🧹",
  "author": "macg@macgworld.com",
  "tags": [
    "disk",
    "cleanup",
    "storagesense",
    "configuration"
  ],
  "created": "2026-09-06T12:00:00Z",
  "modified": "2026-09-06T12:00:00Z",
  "workspaceOne": {
    "language": "POWERSHELL",
    "executionContext": "SYSTEM",
    "executionArchitecture": "EITHER64OR32BIT",
    "timeout": 60,
    "appCatalog": {
      "enabled": false,
      "displayName": "",
      "displayDescription": "",
      "category": ""
    },
    "variables": []
  },
  "codeBase64": "JEVycm9yQWN0aW9uUHJlZmVyZW5jZSA9ICdTdG9wJwokTG9nRmlsZSA9ICIkZW52OlByb2dyYW1EYXRhXE1hY0dXb3JsZFxMb2dzXGVuYWJsZS1zdG9yYWdlLXNlbnNlLmxvZyIKZnVuY3Rpb24gV3JpdGUtTG9nKFtzdHJpbmddJG0pIHsKICAgIHRyeSB7CiAgICAgICAgJGQgPSBTcGxpdC1QYXRoIC1QYXRoICRMb2dGaWxlIC1QYXJlbnQKICAgICAgICBpZiAoLW5vdCAoVGVzdC1QYXRoIC1MaXRlcmFsUGF0aCAkZCkpIHsgTmV3LUl0ZW0gLUl0ZW1UeXBlIERpcmVjdG9yeSAtUGF0aCAkZCAtRm9yY2UgfCBPdXQtTnVsbCB9CiAgICAgICAgQWRkLUNvbnRlbnQgLUxpdGVyYWxQYXRoICRMb2dGaWxlIC1WYWx1ZSAoJ3swOnl5eXktTU0tZGQgSEg6bW06c3N9IHsxfScgLWYgKEdldC1EYXRlKSwgJG0pCiAgICB9IGNhdGNoIHsgfQp9CnRyeSB7CgogICAgJGsgPSAnSEtMTTpcU09GVFdBUkVcUG9saWNpZXNcTWljcm9zb2Z0XFdpbmRvd3NcU3RvcmFnZVNlbnNlJwogICAgJHAgPSBHZXQtSXRlbVByb3BlcnR5IC1MaXRlcmFsUGF0aCAkayAtRXJyb3JBY3Rpb24gU2lsZW50bHlDb250aW51ZQogICAgaWYgKCRudWxsIC1uZSAkcC5BbGxvd1N0b3JhZ2VTZW5zZUdsb2JhbCAtYW5kIFtpbnRdJHAuQWxsb3dTdG9yYWdlU2Vuc2VHbG9iYWwgLWVxIDEgLWFuZAogICAgICAgICRudWxsIC1uZSAkcC5Db25maWdTdG9yYWdlU2Vuc2VHbG9iYWxDYWRlbmNlIC1hbmQgW2ludF0kcC5Db25maWdTdG9yYWdlU2Vuc2VHbG9iYWxDYWRlbmNlIC1lcSAzMCkgewogICAgICAgIFdyaXRlLUxvZyAnQWxyZWFkeSBjb21wbGlhbnQsIG5vIGFjdGlvbicKICAgICAgICBleGl0IDAKICAgIH0KICAgIGlmICgtbm90IChUZXN0LVBhdGggLUxpdGVyYWxQYXRoICRrKSkgeyBOZXctSXRlbSAtUGF0aCAkayAtRm9yY2UgfCBPdXQtTnVsbCB9CiAgICBXcml0ZS1Mb2cgJ0VuYWJsaW5nIFN0b3JhZ2UgU2Vuc2Ugd2l0aCBhIG1vbnRobHkgY2FkZW5jZScKICAgIE5ldy1JdGVtUHJvcGVydHkgLUxpdGVyYWxQYXRoICRrIC1OYW1lICdBbGxvd1N0b3JhZ2VTZW5zZUdsb2JhbCcgLVZhbHVlIDEgLVByb3BlcnR5VHlwZSBEV29yZCAtRm9yY2UgfCBPdXQtTnVsbAogICAgTmV3LUl0ZW1Qcm9wZXJ0eSAtTGl0ZXJhbFBhdGggJGsgLU5hbWUgJ0NvbmZpZ1N0b3JhZ2VTZW5zZUdsb2JhbENhZGVuY2UnIC1WYWx1ZSAzMCAtUHJvcGVydHlUeXBlIERXb3JkIC1Gb3JjZSB8IE91dC1OdWxsCiAgICBOZXctSXRlbVByb3BlcnR5IC1MaXRlcmFsUGF0aCAkayAtTmFtZSAnQ29uZmlnU3RvcmFnZVNlbnNlUmVjeWNsZUJpbkNsZWFudXBUaHJlc2hvbGQnIC1WYWx1ZSAzMCAtUHJvcGVydHlUeXBlIERXb3JkIC1Gb3JjZSB8IE91dC1OdWxsCiAgICBOZXctSXRlbVByb3BlcnR5IC1MaXRlcmFsUGF0aCAkayAtTmFtZSAnQWxsb3dTdG9yYWdlU2Vuc2VUZW1wb3JhcnlGaWxlc0NsZWFudXAnIC1WYWx1ZSAxIC1Qcm9wZXJ0eVR5cGUgRFdvcmQgLUZvcmNlIHwgT3V0LU51bGwKICAgICRhID0gR2V0LUl0ZW1Qcm9wZXJ0eSAtTGl0ZXJhbFBhdGggJGsKICAgIGlmIChbaW50XSRhLkFsbG93U3RvcmFnZVNlbnNlR2xvYmFsIC1lcSAxKSB7IFdyaXRlLUxvZyAnU3RvcmFnZSBTZW5zZSBlbmFibGVkJzsgZXhpdCAwIH0KICAgIGV4aXQgMzAKfSBjYXRjaCB7CiAgICBXcml0ZS1Mb2cgKCJVbmhhbmRsZWQgZXJyb3I6ICIgKyAkXy5FeGNlcHRpb24uTWVzc2FnZSkKICAgIGV4aXQgMjAKfQo="
}
