{
  "schemaVersion": "1.2",
  "id": "555cd2c7-2cc9-4c11-bd26-87a0da32b672",
  "slug": "bitlocker-recovery-password-present",
  "type": "sensor",
  "name": "BitLocker Recovery Password Present",
  "description": "Console sensor name: bitlocker_recovery_password_present. True when the OS volume carries a RecoveryPassword key protector. A device encrypted without one cannot be recovered and is the fleet's real BitLocker risk.",
  "version": "1.0.0",
  "release": "production",
  "os": "Windows",
  "icon": "🔑",
  "author": "macg@macgworld.com",
  "tags": [
    "bitlocker",
    "encryption",
    "recovery",
    "compliance"
  ],
  "created": "2026-09-06T12:00:00Z",
  "modified": "2026-09-06T12:00:00Z",
  "workspaceOne": {
    "language": "POWERSHELL",
    "executionContext": "SYSTEM",
    "executionArchitecture": "ONLY64BIT",
    "responseDataType": "BOOLEAN"
  },
  "codeBase64": "IyAtLS0tLS0tLS0tLS0tLS0tLS0tLS0tLS0tLS0tLS0tLS0tLS0tLS0tLS0tLS0tLS0tLS0tLS0tLS0tLS0tLS0tLS0tLS0tLS0tLS0KIyAgRElTQ0xBSU1FUgojICBQcm92aWRlZCBhcy1pcywgd2l0aCBubyB3YXJyYW50eSBvZiBhbnkga2luZC4gWW91IHJ1biB0aGlzIGF0IHlvdXIgb3duCiMgIHJpc2suIE1hY0cgYWNjZXB0cyBubyBsaWFiaWxpdHkgZm9yIGFueSB1bmV4cGVjdGVkIHJlc3VsdCwgZGF0YSBsb3NzIG9yCiMgIGRhbWFnZSBhcmlzaW5nIGZyb20gaXRzIHVzZS4gQWx3YXlzIHRlc3QgaXQgb24gYSBwaWxvdCBkZXZpY2UgYmVmb3JlCiMgIGRlcGxveWluZyBpdCBicm9hZGx5LgojIC0tLS0tLS0tLS0tLS0tLS0tLS0tLS0tLS0tLS0tLS0tLS0tLS0tLS0tLS0tLS0tLS0tLS0tLS0tLS0tLS0tLS0tLS0tLS0tLS0tLQoKJEVycm9yQWN0aW9uUHJlZmVyZW5jZSA9ICdTdG9wJwp0cnkgewoKICAgICR2ID0gR2V0LUJpdExvY2tlclZvbHVtZSAtTW91bnRQb2ludCAkZW52OlN5c3RlbURyaXZlCiAgICBXcml0ZS1PdXRwdXQgKFtib29sXShAKCR2LktleVByb3RlY3RvciB8IFdoZXJlLU9iamVjdCB7ICRfLktleVByb3RlY3RvclR5cGUgLWVxICdSZWNvdmVyeVBhc3N3b3JkJyB9KS5Db3VudCAtZ3QgMCkpCn0gY2F0Y2ggewogICAgV3JpdGUtT3V0cHV0ICRmYWxzZQp9Cg=="
}
