{
  "schemaVersion": "1.2",
  "id": "1b405c80-4315-447a-81e3-28ba0d495ba8",
  "slug": "flatpak-packages-count",
  "type": "sensor",
  "name": "Flatpak Package Count",
  "description": "Console sensor name: flatpak_packages_count. Number of installed flatpaks. Like snaps, they sit outside the package manager's view, which matters when you are trying to account for every version of an application on the fleet.",
  "version": "1.0.0",
  "release": "production",
  "os": "Linux",
  "icon": "📦",
  "author": "macg@macgworld.com",
  "tags": [
    "flatpak",
    "packages",
    "patching",
    "inventory"
  ],
  "created": "2026-09-06T12:00:00Z",
  "modified": "2026-09-06T12:00:00Z",
  "workspaceOne": {
    "language": "BASH",
    "executionContext": "SYSTEM",
    "responseDataType": "INTEGER"
  },
  "codeBase64": "IyEvYmluL2Jhc2gKUEFUSD0vdXNyL2xvY2FsL3NiaW46L3Vzci9sb2NhbC9iaW46L3Vzci9zYmluOi91c3IvYmluOi9zYmluOi9iaW4KZXhwb3J0IFBBVEgKTENfQUxMPUMKZXhwb3J0IExDX0FMTAoKaWYgISBjb21tYW5kIC12IGZsYXRwYWsgPi9kZXYvbnVsbCAyPiYxOyB0aGVuCiAgZWNobyAiMCIKZWxzZQogIG49JChmbGF0cGFrIGxpc3QgLS1hcHAgMj4vZGV2L251bGwgfCBncmVwIC1jIC4pCiAgY2FzZSAiJG4iIGluICcnfCpbITAtOV0qKSBuPTAgOzsgZXNhYwogIGVjaG8gIiRuIgpmaQo="
}
