{
  "schemaVersion": "1.2",
  "id": "98705b65-f122-4bd7-9001-c1624d346c07",
  "slug": "zoom-version",
  "type": "sensor",
  "name": "Zoom Version",
  "description": "Console sensor name: zoom_version. Installed Zoom client version, or NotInstalled. Zoom self-updates by default, so a device several versions behind usually has the update path blocked rather than the app abandoned.",
  "version": "1.0.0",
  "release": "production",
  "os": "macOS",
  "icon": "📹",
  "author": "macg@macgworld.com",
  "tags": [
    "zoom",
    "collaboration",
    "applications",
    "patching"
  ],
  "created": "2026-09-06T12:00:00Z",
  "modified": "2026-09-06T12:00:00Z",
  "workspaceOne": {
    "language": "ZSH",
    "executionContext": "SYSTEM",
    "responseDataType": "STRING"
  },
  "codeBase64": "IyEvYmluL3pzaAojIC0tLS0tLS0tLS0tLS0tLS0tLS0tLS0tLS0tLS0tLS0tLS0tLS0tLS0tLS0tLS0tLS0tLS0tLS0tLS0tLS0tLS0tLS0tLS0tLS0tLQojICBESVNDTEFJTUVSCiMgIFByb3ZpZGVkIGFzLWlzLCB3aXRoIG5vIHdhcnJhbnR5IG9mIGFueSBraW5kLiBZb3UgcnVuIHRoaXMgYXQgeW91ciBvd24KIyAgcmlzay4gTWFjRyBhY2NlcHRzIG5vIGxpYWJpbGl0eSBmb3IgYW55IHVuZXhwZWN0ZWQgcmVzdWx0LCBkYXRhIGxvc3Mgb3IKIyAgZGFtYWdlIGFyaXNpbmcgZnJvbSBpdHMgdXNlLiBBbHdheXMgdGVzdCBpdCBvbiBhIHBpbG90IGRldmljZSBiZWZvcmUKIyAgZGVwbG95aW5nIGl0IGJyb2FkbHkuCiMgLS0tLS0tLS0tLS0tLS0tLS0tLS0tLS0tLS0tLS0tLS0tLS0tLS0tLS0tLS0tLS0tLS0tLS0tLS0tLS0tLS0tLS0tLS0tLS0tLS0tCgpQQVRIPS91c3IvbG9jYWwvc2JpbjovdXNyL2xvY2FsL2JpbjovdXNyL3NiaW46L3Vzci9iaW46L3NiaW46L2JpbgpleHBvcnQgUEFUSApMQ19BTEw9QwpleHBvcnQgTENfQUxMCgpwPSIvQXBwbGljYXRpb25zL3pvb20udXMuYXBwL0NvbnRlbnRzL0luZm8ucGxpc3QiCmlmIFsgISAtZiAiJHAiIF07IHRoZW4KICBlY2hvICJOb3RJbnN0YWxsZWQiCmVsc2UKICB2PSQoZGVmYXVsdHMgcmVhZCAiJHAiIENGQnVuZGxlU2hvcnRWZXJzaW9uU3RyaW5nIDI+L2Rldi9udWxsKQogIFsgLXogIiR2IiBdICYmIHY9IlVua25vd24iCiAgZWNobyAiJHYiCmZpCg=="
}
