{
  "schemaVersion": "1.2",
  "id": "82b24997-e510-471b-a171-9ecc296d1c13",
  "slug": "laps-password-age-days",
  "type": "sensor",
  "name": "LAPS Password Age (Days)",
  "description": "Console sensor name: laps_password_age_days. Days since Windows LAPS last rotated the managed local account password, from the LAPS state key. Returns -1 where Windows LAPS is not in use - legacy Microsoft LAPS keeps its expiry in AD, not on the device.",
  "version": "1.0.0",
  "release": "production",
  "os": "Windows",
  "icon": "🔑",
  "author": "macg@macgworld.com",
  "tags": [
    "laps",
    "accounts",
    "security",
    "compliance"
  ],
  "created": "2026-09-06T12:00:00Z",
  "modified": "2026-09-06T12:00:00Z",
  "workspaceOne": {
    "language": "POWERSHELL",
    "executionContext": "SYSTEM",
    "executionArchitecture": "EITHER64OR32BIT",
    "responseDataType": "INTEGER"
  },
  "codeBase64": "JEVycm9yQWN0aW9uUHJlZmVyZW5jZSA9ICdTdG9wJwp0cnkgewoKICAgICRrID0gJ0hLTE06XFNvZnR3YXJlXE1pY3Jvc29mdFxXaW5kb3dzXEN1cnJlbnRWZXJzaW9uXExBUFNcU3RhdGUnCiAgICAkdiA9IChHZXQtSXRlbVByb3BlcnR5IC1MaXRlcmFsUGF0aCAkayAtTmFtZSAnTGFzdFBhc3N3b3JkVXBkYXRlVGltZScgLUVycm9yQWN0aW9uIFNpbGVudGx5Q29udGludWUpLkxhc3RQYXNzd29yZFVwZGF0ZVRpbWUKICAgIGlmICgkbnVsbCAtZXEgJHYpIHsgV3JpdGUtT3V0cHV0IC0xIH0KICAgIGVsc2UgewogICAgICAgICRmdCA9IDAKICAgICAgICBpZiAoJHYgLWlzIFtieXRlW11dKSB7ICRmdCA9IFtTeXN0ZW0uQml0Q29udmVydGVyXTo6VG9JbnQ2NCgkdiwgMCkgfSBlbHNlIHsgJGZ0ID0gW2ludDY0XSR2IH0KICAgICAgICBpZiAoJGZ0IC1sZSAwKSB7IFdyaXRlLU91dHB1dCAtMSB9CiAgICAgICAgZWxzZSB7IFdyaXRlLU91dHB1dCAoW2ludF1bbWF0aF06OkZsb29yKCgoR2V0LURhdGUpIC0gW2RhdGV0aW1lXTo6RnJvbUZpbGVUaW1lKCRmdCkpLlRvdGFsRGF5cykpIH0KICAgIH0KfSBjYXRjaCB7CiAgICBXcml0ZS1PdXRwdXQgLTEKfQo="
}
