{
  "schemaVersion": "1.2",
  "id": "f2a2a16a-fe1c-45ad-bbd8-45b68035bd98",
  "slug": "days-since-last-login",
  "type": "sensor",
  "name": "Days Since Last Interactive Login",
  "description": "Console sensor name: days_since_last_login. Days since any real user last logged in. A high number on a workstation means the device is idle or abandoned; on a server it is entirely normal and confirms nobody is hand-managing it.",
  "version": "1.0.0",
  "release": "production",
  "os": "Linux",
  "icon": "📅",
  "author": "macg@macgworld.com",
  "tags": [
    "sessions",
    "users",
    "lifecycle",
    "hygiene"
  ],
  "created": "2026-09-06T12:00:00Z",
  "modified": "2026-09-06T12:00:00Z",
  "workspaceOne": {
    "language": "BASH",
    "executionContext": "SYSTEM",
    "responseDataType": "INTEGER"
  },
  "codeBase64": "IyEvYmluL2Jhc2gKIyAtLS0tLS0tLS0tLS0tLS0tLS0tLS0tLS0tLS0tLS0tLS0tLS0tLS0tLS0tLS0tLS0tLS0tLS0tLS0tLS0tLS0tLS0tLS0tLS0tLS0KIyAgRElTQ0xBSU1FUgojICBQcm92aWRlZCBhcy1pcywgd2l0aCBubyB3YXJyYW50eSBvZiBhbnkga2luZC4gWW91IHJ1biB0aGlzIGF0IHlvdXIgb3duCiMgIHJpc2suIE1hY0cgYWNjZXB0cyBubyBsaWFiaWxpdHkgZm9yIGFueSB1bmV4cGVjdGVkIHJlc3VsdCwgZGF0YSBsb3NzIG9yCiMgIGRhbWFnZSBhcmlzaW5nIGZyb20gaXRzIHVzZS4gQWx3YXlzIHRlc3QgaXQgb24gYSBwaWxvdCBkZXZpY2UgYmVmb3JlCiMgIGRlcGxveWluZyBpdCBicm9hZGx5LgojIC0tLS0tLS0tLS0tLS0tLS0tLS0tLS0tLS0tLS0tLS0tLS0tLS0tLS0tLS0tLS0tLS0tLS0tLS0tLS0tLS0tLS0tLS0tLS0tLS0tLQoKUEFUSD0vdXNyL2xvY2FsL3NiaW46L3Vzci9sb2NhbC9iaW46L3Vzci9zYmluOi91c3IvYmluOi9zYmluOi9iaW4KZXhwb3J0IFBBVEgKTENfQUxMPUMKZXhwb3J0IExDX0FMTAoKaWYgISBjb21tYW5kIC12IGxhc3QgPi9kZXYvbnVsbCAyPiYxOyB0aGVuCiAgZWNobyAiLTEiCmVsc2UKICBkPSQobGFzdCAtRiAtbiA1MCAyPi9kZXYvbnVsbCB8IGF3ayAnJDEgIT0gInJlYm9vdCIgJiYgJDEgIT0gInd0bXAiICYmIE5GID4gNiB7cHJpbnQgJDUsICQ2LCAkODsgZXhpdH0nKQogIGlmIFsgLXogIiRkIiBdOyB0aGVuCiAgICBlY2hvICItMSIKICBlbHNlCiAgICB0PSQoZGF0ZSAtZCAiJGQiICslcyAyPi9kZXYvbnVsbCkKICAgIGNhc2UgIiR0IiBpbgogICAgICAnJ3wqWyEwLTldKikgZWNobyAiLTEiIDs7CiAgICAgICopIG5vdz0kKGRhdGUgKyVzKTsgZWNobyAkKCggKG5vdyAtIHQpIC8gODY0MDAgKSkgOzsKICAgIGVzYWMKICBmaQpmaQo="
}
