{
  "schemaVersion": "1.2",
  "id": "87142f3f-8f25-4a73-a122-45d10f3890dd",
  "slug": "disable-legacy-network-services",
  "type": "script",
  "name": "Disable Legacy Network Services",
  "description": "Delivery: packaged post-install. Stops, disables and masks telnet, rsh, rlogin, tftp and vsftpd where they exist. All of them carry credentials in clear text and none belongs on a current fleet.",
  "version": "1.0.0",
  "release": "production",
  "os": "Linux",
  "icon": "🚫",
  "author": "macg@macgworld.com",
  "tags": [
    "packaged",
    "services",
    "network",
    "hardening"
  ],
  "created": "2026-09-06T12:00:00Z",
  "modified": "2026-09-06T12:00:00Z",
  "workspaceOne": {
    "language": "BASH",
    "executionContext": "SYSTEM"
  },
  "codeBase64": "IyEvYmluL2Jhc2gKIyAtLS0tLS0tLS0tLS0tLS0tLS0tLS0tLS0tLS0tLS0tLS0tLS0tLS0tLS0tLS0tLS0tLS0tLS0tLS0tLS0tLS0tLS0tLS0tLS0tLS0KIyAgRElTQ0xBSU1FUgojICBQcm92aWRlZCBhcy1pcywgd2l0aCBubyB3YXJyYW50eSBvZiBhbnkga2luZC4gWW91IHJ1biB0aGlzIGF0IHlvdXIgb3duCiMgIHJpc2suIE1hY0cgYWNjZXB0cyBubyBsaWFiaWxpdHkgZm9yIGFueSB1bmV4cGVjdGVkIHJlc3VsdCwgZGF0YSBsb3NzIG9yCiMgIGRhbWFnZSBhcmlzaW5nIGZyb20gaXRzIHVzZS4gQWx3YXlzIHRlc3QgaXQgb24gYSBwaWxvdCBkZXZpY2UgYmVmb3JlCiMgIGRlcGxveWluZyBpdCBicm9hZGx5LgojIC0tLS0tLS0tLS0tLS0tLS0tLS0tLS0tLS0tLS0tLS0tLS0tLS0tLS0tLS0tLS0tLS0tLS0tLS0tLS0tLS0tLS0tLS0tLS0tLS0tLQoKUEFUSD0vdXNyL2xvY2FsL3NiaW46L3Vzci9sb2NhbC9iaW46L3Vzci9zYmluOi91c3IvYmluOi9zYmluOi9iaW4KZXhwb3J0IFBBVEgKTENfQUxMPUMKZXhwb3J0IExDX0FMTApMT0c9Ii92YXIvbG9nL21hY2d3b3JsZC1kaXNhYmxlLWxlZ2FjeS1uZXR3b3JrLXNlcnZpY2VzLmxvZyIKbG9nKCkgeyBwcmludGYgJyVzICVzXG4nICIkKGRhdGUgLXUgKyVZLSVtLSVkVCVIOiVNOiVTWikiICIkMSIgPj4iJExPRyIgMj4vZGV2L251bGwgfHwgdHJ1ZTsgfQoKaWYgISBjb21tYW5kIC12IHN5c3RlbWN0bCA+L2Rldi9udWxsIDI+JjE7IHRoZW4gbG9nICJzeXN0ZW1kIGlzIG5vdCB0aGUgaW5pdCBzeXN0ZW0gaGVyZSI7IGV4aXQgMTA7IGZpCmRvbmVfbj0wCmZvciB1IGluIHRlbG5ldC5zb2NrZXQgdGVsbmV0LnNlcnZpY2UgcnNoLnNvY2tldCBybG9naW4uc29ja2V0IHJleGVjLnNvY2tldCB0ZnRwLnNvY2tldCB0ZnRwLnNlcnZpY2UgdnNmdHBkLnNlcnZpY2U7IGRvCiAgc3lzdGVtY3RsIGxpc3QtdW5pdC1maWxlcyAyPi9kZXYvbnVsbCB8IGdyZXAgLXEgIl4kdSIgfHwgY29udGludWUKICBzPSQoc3lzdGVtY3RsIGlzLWVuYWJsZWQgIiR1IiAyPi9kZXYvbnVsbCkKICBbICIkcyIgPSAibWFza2VkIiBdICYmIGNvbnRpbnVlCiAgc3lzdGVtY3RsIGRpc2FibGUgLS1ub3cgIiR1IiA+L2Rldi9udWxsIDI+JjEKICBzeXN0ZW1jdGwgbWFzayAiJHUiID4vZGV2L251bGwgMj4mMQogIGxvZyAiTWFza2VkICR1ICh3YXMgJHMpIgogIGRvbmVfbj0kKChkb25lX24rMSkpCmRvbmUKaWYgWyAiJGRvbmVfbiIgLWVxIDAgXTsgdGhlbiBsb2cgIk5vIGxlZ2FjeSBuZXR3b3JrIHNlcnZpY2VzIHByZXNlbnQgb3IgYWxsIGFscmVhZHkgbWFza2VkLCBubyBhY3Rpb24iOyBleGl0IDA7IGZpCmxvZyAiTWFza2VkICRkb25lX24gbGVnYWN5IHNlcnZpY2UocykiCmV4aXQgMAo="
}
